{
  "acquisition": {
    "acquisition_channel": "external_authoritative_source",
    "check_cadence_days": 1,
    "consecutive_failures": 0,
    "engine_name": "drupal-knowledge-acquisition-engine",
    "engine_version": "0.1",
    "last_attempt_at": "2026-10-31T12:37:06Z",
    "last_attempt_run_id": "run.20261031T123706.8bf7aa5f",
    "last_attempt_status": "unchanged",
    "last_error": null,
    "last_success_at": "2026-10-31T12:37:06Z",
    "last_success_run_id": "run.20261031T123706.8bf7aa5f",
    "previous_snapshot_sha256": "sha256:feaf4ebad3453894ae600de7730efd6ea31c0ea298e7d3fb145763b2b3697536",
    "review_candidate_id": "source-change.drupal-security-core.c4a55338d058fa8f"
  },
  "content_length": 34068,
  "content_sha256": "sha256:dc1a8aff82b63586eff3ddf872d0132382feff80acc15b612ee07ce5a42add02",
  "etag": "\"1793450229-1\"",
  "fetch_url": "https://www.drupal.org/security/core",
  "last_changed_at": "2026-10-15T04:44:03Z",
  "last_modified": "Sat, 31 Oct 2026 12:37:09 GMT",
  "source_id": "drupal-security-core",
  "url": "https://www.drupal.org/security/core"
}
