{
  "acquisition": {
    "acquisition_channel": "external_authoritative_source",
    "check_cadence_days": 1,
    "consecutive_failures": 0,
    "engine_name": "drupal-knowledge-acquisition-engine",
    "engine_version": "0.1",
    "last_attempt_at": "2026-10-17T15:38:12Z",
    "last_attempt_run_id": "run.20261017T153812.9f322fca",
    "last_attempt_status": "changed",
    "last_error": null,
    "last_success_at": "2026-10-17T15:38:12Z",
    "last_success_run_id": "run.20261017T153812.9f322fca",
    "previous_snapshot_sha256": "sha256:e17ac8a580d9c90845b360cee5929c3eaa474d6ad8b3e8358ec0b10b9d045b24",
    "review_candidate_id": "source-change.drupal-security-advisories-core.262392fd583f851b"
  },
  "content_length": 159677,
  "content_sha256": "sha256:3269848e2c4d5f6a410e16d248f0e198ed540a58930597ed0eb02aa5e6d96b7b",
  "etag": null,
  "fetch_url": "https://www.drupal.org/api-d7/node.json?type=sa&field_project=3060&sort=created&direction=DESC&limit=20",
  "last_changed_at": "2026-10-17T15:38:12Z",
  "last_modified": null,
  "source_id": "drupal-security-advisories-core",
  "url": "https://www.drupal.org/security/core"
}
