{
  "acquisition": {
    "acquisition_channel": "external_authoritative_source",
    "check_cadence_days": 30,
    "consecutive_failures": 0,
    "engine_name": "drupal-knowledge-acquisition-engine",
    "engine_version": "0.1",
    "last_attempt_at": "2026-10-08T23:23:07Z",
    "last_attempt_run_id": "run.20261008T232307.1b71f964",
    "last_attempt_status": "changed",
    "last_error": null,
    "last_success_at": "2026-10-08T23:23:07Z",
    "last_success_run_id": "run.20261008T232307.1b71f964",
    "previous_snapshot_sha256": "sha256:9b9b29988d9a578f1c1aa42e199468eb01c48ec4d1f47e0d04720e494547288c",
    "review_candidate_id": "source-change.drupal-api-deprecated-9-p2.82df86fa49c0dee2"
  },
  "content_length": 80456,
  "content_sha256": "sha256:3a1cbae62a8dff004209afd42c81d5a528a14cae7e6903700834881df00406ed",
  "etag": null,
  "fetch_url": "https://api.drupal.org/api/drupal/deprecated/9?page=2",
  "last_changed_at": "2026-10-08T23:23:07Z",
  "last_modified": null,
  "source_id": "drupal-api-deprecated-9-p2",
  "url": "https://api.drupal.org/api/drupal/deprecated/9"
}
