{
  "acquisition": {
    "acquisition_channel": "external_authoritative_source",
    "check_cadence_days": 30,
    "consecutive_failures": 0,
    "engine_name": "drupal-knowledge-acquisition-engine",
    "engine_version": "0.1",
    "last_attempt_at": "2026-10-08T23:23:07Z",
    "last_attempt_run_id": "run.20261008T232307.1b71f964",
    "last_attempt_status": "changed",
    "last_error": null,
    "last_success_at": "2026-10-08T23:23:07Z",
    "last_success_run_id": "run.20261008T232307.1b71f964",
    "previous_snapshot_sha256": "sha256:322ca48f208aaa048e06628a58371515c74386c9079123679eecd1687e8a477f",
    "review_candidate_id": "source-change.drupal-api-deprecated-9-p3.dff41163a9851a31"
  },
  "content_length": 82302,
  "content_sha256": "sha256:0bdcd5d25fb8fdfd43a22b9cc1bae4b7bb9cd6bedd4484d8f42a23b8be4aa4a8",
  "etag": null,
  "fetch_url": "https://api.drupal.org/api/drupal/deprecated/9?page=3",
  "last_changed_at": "2026-10-08T23:23:07Z",
  "last_modified": null,
  "source_id": "drupal-api-deprecated-9-p3",
  "url": "https://api.drupal.org/api/drupal/deprecated/9"
}
