{
  "acquisition": {
    "acquisition_channel": "external_authoritative_source",
    "check_cadence_days": 1,
    "consecutive_failures": 0,
    "engine_name": "drupal-knowledge-acquisition-engine",
    "engine_version": "0.1",
    "last_attempt_at": "2026-10-23T21:26:36Z",
    "last_attempt_run_id": "run.20261023T212636.ae035f05",
    "last_attempt_status": "changed",
    "last_error": null,
    "last_success_at": "2026-10-23T21:26:36Z",
    "last_success_run_id": "run.20261023T212636.ae035f05",
    "previous_snapshot_sha256": "sha256:90dc7a46270ce4ce32a8b2f2ddbca922cb666f2ce0d1fa21e25baef0a6e2892f",
    "review_candidate_id": "source-change.drupal-security-contrib.bc478fa4b48e95e7"
  },
  "content_length": 38486,
  "content_sha256": "sha256:878b1e4275e99a258e9365db68655432aa9a78238599ddf5c9a6268c39f47aff",
  "etag": "\"1792790797-1\"",
  "fetch_url": "https://www.drupal.org/security/contrib",
  "last_changed_at": "2026-10-23T21:26:36Z",
  "last_modified": "Fri, 23 Oct 2026 21:26:37 GMT",
  "source_id": "drupal-security-contrib",
  "url": "https://www.drupal.org/security/contrib"
}
