{
  "acquisition": {
    "acquisition_channel": "external_authoritative_source",
    "check_cadence_days": 30,
    "consecutive_failures": 0,
    "engine_name": "drupal-knowledge-acquisition-engine",
    "engine_version": "0.1",
    "last_attempt_at": "2026-10-08T23:23:07Z",
    "last_attempt_run_id": "run.20261008T232307.1b71f964",
    "last_attempt_status": "unchanged",
    "last_error": null,
    "last_success_at": "2026-10-08T23:23:07Z",
    "last_success_run_id": "run.20261008T232307.1b71f964",
    "previous_snapshot_sha256": null,
    "review_candidate_id": null
  },
  "content_length": 2439,
  "content_sha256": "sha256:82c4fc596dbd7339b25a5c21f7d8c50a6288a7d1adff8017784055790d8a5410",
  "etag": "\"1791501797-1\"",
  "fetch_url": "https://www.drupal.org/docs/upgrading-drupal/upgrading-drupal/upgrade-process-overview",
  "last_changed_at": "2026-09-08T21:12:44Z",
  "last_modified": "Thu, 08 Oct 2026 23:23:17 GMT",
  "source_id": "drupal-upgrade-process-overview",
  "url": "https://www.drupal.org/docs/upgrading-drupal/upgrading-drupal/upgrade-process-overview"
}
