{
  "acquisition": {
    "acquisition_channel": "external_authoritative_source",
    "check_cadence_days": 1,
    "consecutive_failures": 0,
    "engine_name": "drupal-knowledge-acquisition-engine",
    "engine_version": "0.1",
    "last_attempt_at": "2026-10-23T21:26:36Z",
    "last_attempt_run_id": "run.20261023T212636.ae035f05",
    "last_attempt_status": "changed",
    "last_error": null,
    "last_success_at": "2026-10-23T21:26:36Z",
    "last_success_run_id": "run.20261023T212636.ae035f05",
    "previous_snapshot_sha256": "sha256:bbd1b34ae069f5ad4139f33e2f67a74dfb3cf715aea61e5f4308ed97204ae639",
    "review_candidate_id": "source-change.drupal-core-releases.3314cf52e01425df"
  },
  "content_length": 560756,
  "content_sha256": "sha256:a813f9c56510872cc8ae42220ccc6098dfb5790afefe784dd0834f1e32b43bb4",
  "etag": null,
  "fetch_url": "https://updates.drupal.org/release-history/drupal/current",
  "last_changed_at": "2026-10-23T21:26:36Z",
  "last_modified": "Fri, 23 Oct 2026 21:19:27 GMT",
  "source_id": "drupal-core-releases",
  "url": "https://www.drupal.org/project/drupal/releases"
}
