{
  "acquisition": {
    "acquisition_channel": "external_authoritative_source",
    "check_cadence_days": 30,
    "consecutive_failures": 0,
    "engine_name": "drupal-knowledge-acquisition-engine",
    "engine_version": "0.1",
    "last_attempt_at": "2026-10-08T23:23:07Z",
    "last_attempt_run_id": "run.20261008T232307.1b71f964",
    "last_attempt_status": "changed",
    "last_error": null,
    "last_success_at": "2026-10-08T23:23:07Z",
    "last_success_run_id": "run.20261008T232307.1b71f964",
    "previous_snapshot_sha256": "sha256:644a9dd934245480ebd33f0c67ad4af0ecfa16db0dab5a90dffb0915fd5e3dfb",
    "review_candidate_id": "source-change.drupal-apis-guide.5726bd6d9330b7ac"
  },
  "content_length": 7577,
  "content_sha256": "sha256:0cefdc03b63061909b167d0282c67e5c0a62944145444a038b8730380e4fa758",
  "etag": "\"1791501787-1\"",
  "fetch_url": "https://www.drupal.org/docs/develop/drupal-apis",
  "last_changed_at": "2026-10-08T23:23:07Z",
  "last_modified": "Thu, 08 Oct 2026 23:23:07 GMT",
  "source_id": "drupal-apis-guide",
  "url": "https://www.drupal.org/docs/develop/drupal-apis"
}
