{
  "acquisition": {
    "acquisition_channel": "external_authoritative_source",
    "check_cadence_days": 90,
    "consecutive_failures": 0,
    "engine_name": "drupal-knowledge-acquisition-engine",
    "engine_version": "0.1",
    "last_attempt_at": "2026-09-08T15:02:49Z",
    "last_attempt_run_id": "run.20260908T150249.31ed3696",
    "last_attempt_status": "unchanged",
    "last_error": null,
    "last_success_at": "2026-09-08T15:02:49Z",
    "last_success_run_id": "run.20260908T150249.31ed3696",
    "previous_snapshot_sha256": null,
    "review_candidate_id": null
  },
  "content_length": 4814,
  "content_sha256": "sha256:5076c3ad1871e97b198e7dda5caf20084cf4514403025ea751153ab212b879eb",
  "etag": "\"1a7335c92e429f3824a3a38617f88a2d\"",
  "fetch_url": "https://git.drupalcode.org/project/drupal/-/raw/11.4.5/core/modules/update/src/UpdateManagerInterface.php",
  "last_changed_at": "2026-09-07T19:56:50Z",
  "last_modified": null,
  "source_id": "drupal-update-manager-interface-semantics",
  "url": "https://api.drupal.org/api/drupal/core%21modules%21update%21src%21UpdateManagerInterface.php/interface/UpdateManagerInterface/11.x"
}
